,category,definition,name,note,provenance,provenance_uri,resource_uri,term,vocabulary_id,vocabulary_status
0,SamplingCurve,"A narrow shaft bored into the ground, either vertically or horizontally. A borehole includes the hole cavity and walls surrounding that cavity.  ",Borehole,"Term retrived from OGC Observations & Measurements (e.g., see https://www.seegrid.csiro.au/wiki/AppSchemas/ObservationsAndSampling#Sampling_model).  Parts of the definition came from Wikipedia (see http://en.wikipedia.org/wiki/Borehole).","Example from OGC Observations & Measurements, but listed as Sample Type in SESAR",,/api/v1/samplingfeaturetype/borehole/,borehole,1148,Current
1,SamplingSurface,The intersection of a body in three-dimensional space with a plane.  Represented as a polygon. ,Cross section,"Term retrived from OGC Observations & Measurements (e.g., see https://www.seegrid.csiro.au/wiki/AppSchemas/ObservationsAndSampling#Sampling_model).  Parts of the definition came from Wikipedia (see http://en.wikipedia.org/wiki/Cross_section_(geometry)).",Term from OGC Observations & Measurements. Partial definition from Wikipedia.,,/api/v1/samplingfeaturetype/crossSection/,crossSection,1149,Current
2,Specimen,"A CTD (Conductivity, Temperature, and Depth) cast is a water column depth profile collected over a specific and relatively short date-time range, that can be considered as a parent specimen.",CTD,,SESAR. See http://www.geosamples.org/help/vocabularies#object.,,/api/v1/samplingfeaturetype/CTD/,CTD,1150,Current
3,SamplingCurve,"A discrete segment along a longer vertical path, such as a borehole, soil profile or other depth profile, in which an observation or specimen is collected over the distance between the upper and lower depth limits of the interval. A Depth Interval is a sub-type of Interval.",Depth interval,,CZchemDB,,/api/v1/samplingfeaturetype/depthInterval/,depthInterval,1151,Current
4,SamplingSurface,"Ecological land classification is a cartographical delineation of distinct ecological areas, identified by their geology, topography, soils, vegetation, climate conditions, living species, habitats, water resources, as well as anthropic factors. These factors control and influence biotic composition and ecological processes.",Ecological land classification,,Wikipedia,https://en.wikipedia.org/wiki/Ecological_land_classification,/api/v1/samplingfeaturetype/ecologicalLandClassification/,ecologicalLandClassification,1519,Current
5,SamplingSolid,"An artificially constructed cavity in the earth that is deeper than the soil, larger than a well bore, and substantially open to the atmosphere. The diameter of an excavation is typically similar or larger than the depth. Excavations include building-foundation diggings, roadway cuts, and surface mines.",Excavation,This is a term from the USGS site types http://wdr.water.usgs.gov/nwisgmap/help/sitetype.html that was originally included in the CUAHSI SiteTypeCV.  It is more appropriate as a SamplingFeatureType.,Originally from USGS Site Types,,/api/v1/samplingfeaturetype/excavation/,excavation,1152,Current
6,SamplingSurface,A location at which field experiments or observations of ambient conditions are conducted. A field area may contain many sites and has a geographical footprint that can be represented by a polygon.,Field area,Useful for Critical Zone Observatory network and other programs to describe a terrestrial research area.  Can be hiearchical (i.e. CRB-CZO > WhiteClayCreek@SWRC > TransectA.  See http://criticalzone.org/christina/infrastructure/field-areas-christina/).,Used by CriticalZone.org,,/api/v1/samplingfeaturetype/fieldArea/,fieldArea,1153,Current
7,SamplingCurve,A path along which an aircraft travels while measuring a phenomena of study.,Flightline,"Term retrived from OGC Observations & Measurements (e.g., see https://www.seegrid.csiro.au/wiki/AppSchemas/ObservationsAndSampling#Sampling_model)",OGC Observations & Measurements,,/api/v1/samplingfeaturetype/flightline/,flightline,1154,Current
8,SamplingCurve,A discrete segment along a longer path in which an observation or specimen is collected over the distance between the upper and lower bounds of the interval. A Depth Interval is a sub-type of Interval.,Interval,"Term retrived from OGC Observations & Measurements (e.g., see https://www.seegrid.csiro.au/wiki/AppSchemas/ObservationsAndSampling#Sampling_model)",OGC Observations & Measurements,,/api/v1/samplingfeaturetype/interval/,interval,1155,Current
9,SamplingCurve,"A hole or shaft constructed in the earth intended to be used to locate, sample, or develop groundwater, oil, gas, or some other subsurface material. The diameter of a well is typically much smaller than the depth. Wells are also used to artificially recharge groundwater or to pressurize oil and gas production zones. Specific kinds of wells should be specified in the SamplingFeature description. For example, underground waste-disposal wells should be classified as waste injection wells.",Observation well,"The term is from OGC Observations and Measurements (see https://www.seegrid.csiro.au/wiki/AppSchemas/ObservationsAndSampling#Sampling_model), but the definition is from the USGS SiteTypes http://wdr.water.usgs.gov/nwisgmap/help/sitetype.html.",OGC Observations & Measurements,,/api/v1/samplingfeaturetype/observationWell/,observationWell,1156,Current
10,SamplingCurve,"A one-dimensional grid at fixed (x, y, t) coordinates within a four-dimensional (x, y, z, t) coordinate reference system. The grid axis is aligned with the coordinate reference system z-axis. Typically used to characterize or measure phenomena as a function of depth.",Profile,"Term retrived from OGC Observations & Measurements (e.g., see https://www.seegrid.csiro.au/wiki/AppSchemas/ObservationsAndSampling#Sampling_model)",OGC Observations & Measurements,,/api/v1/samplingfeaturetype/profile/,profile,1157,Current
11,SamplingSurface,A small plot used to isolate a standard unit of area for study of the distribution of an item over a large area.,Quadrat,"Term retrived from OGC Observations & Measurements (e.g., see https://www.seegrid.csiro.au/wiki/AppSchemas/ObservationsAndSampling#Sampling_model). Parts of the definition came from Wikipedia (see http://en.wikipedia.org/wiki/Quadrat).",Term from OGC Observations & Measurements. Partial definition from Wikipedia.,,/api/v1/samplingfeaturetype/quadrat/,quadrat,1158,Current
12,SamplingSurface,A two-dimensional visual extent within a physical environment.,Scene,"Term retrived from OGC Observations & Measurements (e.g., see https://www.seegrid.csiro.au/wiki/AppSchemas/ObservationsAndSampling#Sampling_model).  Parts of the definition came from Wikipedia (see http://en.wikipedia.org/wiki/Scene_(perception)).",Term from OGC Observations & Measurements. Partial definition from Wikipedia.,,/api/v1/samplingfeaturetype/scene/,scene,1159,Current
13,SamplingCurve,A path along which a ship or vessel travels while measuring a phenomena of study.  Represented as a line connecting the ship's consecutive positions on the surface of the earth.,Ships track,"Term retrived from OGC Observations & Measurements (e.g., see https://www.seegrid.csiro.au/wiki/AppSchemas/ObservationsAndSampling#Sampling_model)",OGC Observations & Measurements,,/api/v1/samplingfeaturetype/shipsTrack/,shipsTrack,1160,Current
14,SamplingPoint,"A facility or location at which observations have been collected. A site may have instruments or equipment installed and may contain multiple other sampling features (e.g., a stream gage, weather station, observation well, etc.). Additionally, many specimen sampling features may be collected at a site. Sites are also often referred to as stations. A site is represented as a point, but it may have a geographical footprint that is not a point. The site coordinates serve as a reference for the site and offsets may be specified from this reference location.",Site,,CUAHSI Observations Data Model,,/api/v1/samplingfeaturetype/site/,site,1161,Current
15,SamplingSurface,Two-dimensional vertical face of a soil pit that is described and sampled.,Soil pit section,,CZchemDB,,/api/v1/samplingfeaturetype/soilPitSection/,soilPitSection,1162,Current
16,Specimen,"A physical sample (object or entity) obtained for observations, typically performed ex situ, often in a laboratory.  ",Specimen,,OGC Observations & Measurements,http://www.opengis.net/def/samplingFeatureType/OGC-OM/2.0/SF_Specimen,/api/v1/samplingfeaturetype/specimen/,specimen,1163,Current
17,SamplingPoint,"A location used to monitor and test terrestrial bodies of water. Hydrometric measurements of water level, surface elevation (""stage"") and/or volumetric discharge (flow) are generally taken, and observations of biota and water quality may also be made. ",Stream gage,Definition adapted from Wikpedia (http://en.wikipedia.org/wiki/Stream_gauge).,Term adapted from Wikipedia,,/api/v1/samplingfeaturetype/streamGage/,streamGage,1164,Current
18,SamplingCurve,The path that a moving object follows through space as a function of time. A trajectory can be described by the geometry of the path or as the position of the object over time. ,Trajectory,"Term retrived from OGC Observations & Measurements (e.g., see https://www.seegrid.csiro.au/wiki/AppSchemas/ObservationsAndSampling#Sampling_model). Parts of the definition came from Wikipedia (see http://en.wikipedia.org/wiki/Trajectory).",Term from OGC Observations & Measurements. Partial definition from Wikipedia.,,/api/v1/samplingfeaturetype/trajectory/,trajectory,1165,Current
19,SamplingCurve,A path along which ocurrences of a phenomena of study are counted or measured.,Transect,,,,/api/v1/samplingfeaturetype/transect/,transect,1166,Current
20,SamplingCurve,A field control network consisting of survey stations placed along a line or path of travel.,Traverse,"Term retrived from OGC Observations & Measurements (e.g., see https://www.seegrid.csiro.au/wiki/AppSchemas/ObservationsAndSampling#Sampling_model). Parts of the definition came from Wikipedia (see http://en.wikipedia.org/wiki/Traverse_(surveying)).",Term from OGC Observations & Measurements. Partial definition from Wikipedia.,,/api/v1/samplingfeaturetype/traverse/,traverse,1167,Current
21,SamplingPoint,"A location used to monitor and test the quality of terrestrial bodies of water. Water quality stations may be locations at which physical water samples are collected for ex situ analysis.  Water qulaity stations may also have instruments and equipment for continuous, in situ measurement of water quality variables. ",Water quality station,,,,/api/v1/samplingfeaturetype/waterQualityStation/,waterQualityStation,1168,Current
22,SamplingPoint,"A facility, either on land or sea, with instruments and equipment for measuring atmospheric conditions to provide information for weather forecasts and to study weather and climate.",Weather station,Definition adapted from Wikpedia (http://en.wikipedia.org/wiki/Weather_station).,Term adapted from Wikipedia,,/api/v1/samplingfeaturetype/weatherStation/,weatherStation,1169,Current
