,category,default_unit,definition,dimension_amount,dimension_current,dimension_length,dimension_light,dimension_mass,dimension_symbol,dimension_temperature,dimension_time,name,note,provenance,provenance_uri,resource_uri,term,vocabulary_id,vocabulary_status
102,Photometry,Lumen (lm),"Luminous Flux or Luminous Power is the measure of the perceived power of light. It differs from radiant flux, the measure of the total power of light emitted, in that luminous flux is adjusted to reflect the varying sensitivity of the human eye to different wavelengths of light.",0,0.0,1,0.0,0,U1J1,0.0,0,Luminous flux,,QUDT,http://qudt.org/vocab/quantity#Luminousflux,/api/v1/unitstype/luminousFlux/,luminousFlux,1271,Current
103,Base Quantity,Candela (cd),"Luminous Intensity is a measure of the wavelength-weighted power emitted by a light source in a particular direction per unit solid angle. The weighting is determined by the luminosity function, a standardized model of the sensitivity of the human eye to different wavelengths.",0,0.0,0,0.0,0,J1,0.0,0,Luminous intensity,,QUDT,http://qudt.org/vocab/quantity#Luminousintensity,/api/v1/unitstype/luminousIntensity/,luminousIntensity,1272,Current
104,Electricity and Magnetism,Joule per Tesla (J/T),"The magnetic moment of a system is a measure of the magnitude and the direction of its magnetism. Magnetic moment usually refers to its Magnetic Dipole Moment, and quantifies the contribution of the system's internal magnetism to the external dipolar magnetic field produced by the system (that is, the component of the external magnetic field that is inversely proportional to the cube of the distance to the observer). The Magnetic Dipole Moment is a vector-valued quantity.",0,0.0,0,0.0,2,L2I1,1.0,0,Magnetic dipole moment,,QUDT,http://qudt.org/vocab/quantity#Magneticdipolemoment,/api/v1/unitstype/magneticDipoleMoment/,magneticDipoleMoment,1273,Current
105,Electricity and Magnetism,Ampere Turn per Meter (At/m) or Ampere per meter (A/m),"The magnetic field strength, H (also called magnetic field intensity, magnetizing field, or magnetic field), characterizes how the true Magnetic Field B influences the organization of magnetic dipoles in a given medium.",0,0.0,0,0.0,-1,L-1I1,1.0,0,Magnetic field strength,,QUDT,http://qudt.org/schema/qudt#MagneticFieldStrengthUnit,/api/v1/unitstype/magneticFieldStrength/,magneticFieldStrength,1274,Current
106,Electricity and Magnetism,Weber (Wb),Magnetic Flux is the product of the average magnetic field times the perpendicular area that it penetrates.,0,-2.0,0,0.0,2,L2M1T-2I-1,-1.0,1,Magnetic flux,,QUDT,http://qudt.org/vocab/quantity#Magneticflux,/api/v1/unitstype/magneticFlux/,magneticFlux,1275,Current
107,Electricity and Magnetism,Tesla (T),"The Magnetic flux density, B (also called magnetic induction or magnetic field), is a fundamental field in electrodynamics which characterizes the magnetic force exerted by electric currents. It is closely related to the auxillary magnetic field H.",0,-2.0,0,0.0,0,M1T-2I-1,-1.0,1,Magnetic flux density,,QUDT,http://qudt.org/schema/qudt#MagneticFluxDensityUnit,/api/v1/unitstype/magneticFluxDensity/,magneticFluxDensity,1276,Current
108,Electricity and Magnetism,Tesla Meter,Magnetic Flux Per Unit Length,0,-2.0,0,0.0,1,L1M1T-2I-1,-1.0,1,Magnetic flux per length,,QUDT,http://qudt.org/vocab/quantity#Magneticfluxperunitlength,/api/v1/unitstype/magneticFluxPerLength/,magneticFluxPerLength,1277,Current
109,Electricity and Magnetism,Henry per meter (H/m),Permeability is the degree of magnetization of a material that responds linearly to an applied magnetic field. In general permeability is a tensor-valued quantity.,0,-2.0,0,0.0,1,L1M1T-2I-2,-2.0,1,Magnetic permeability,,QUDT,http://qudt.org/schema/qudt#PermeabilityUnit,/api/v1/unitstype/magneticPermeability/,magneticPermeability,1278,Current
110,Electricity and Magnetism,Ampere Turn (At),"Magnetomotive force is any physical cause that produces magnetic flux. In other words, it is a field of magnetism (measured in tesla) that has area (measured in square meters), so that (Tesla)(Area)= Flux. It is analogous to electromotive force or voltage in electricity. MMF usually describes electric wire coils in a way so scientists can measure or predict the actual force a wire coil can generate. [Wikipedia: https://en.wikipedia.org/wiki/Magnetomotive_force]",0,0.0,1,0.0,0,U1I1,1.0,0,Magnetomotive force,,QUDT,http://qudt.org/schema/qudt#MagnetomotiveForceUnit,/api/v1/unitstype/magnetomotiveForce/,magnetomotiveForce,1279,Current
111,Base Quantity,kilogram (kg),"In physics, mass is a property of a physical body which determines the strength of its mutual gravitational attraction to other bodies, its resistance to being accelerated by a force, and in the theory of relativity gives the mass–energy content of a system. The SI unit of mass is the kilogram (kg).",0,0.0,0,0.0,0,M1,0.0,1,Mass,,QUDT,http://qudt.org/vocab/quantity#Mass,/api/v1/unitstype/mass/,mass,1280,Current
112,Chemistry,kilogram mole (kg*mol),,0,0.0,0,1.0,0,M1N1,0.0,1,Mass count,,QUDT,http://qudt.org/vocab/quantity#MassAmountOfSubstance,/api/v1/unitstype/massCount/,massCount,1281,Current
113,Chemistry,Kilogram mole Kelvin (kg*mol*K),,1,0.0,0,1.0,0,M1?1N1,0.0,1,Mass count temperature,,QUDT,http://qudt.org/vocab/quantity#MassAmountOfSubstanceTemperature,/api/v1/unitstype/massCountTemperature/,massCountTemperature,1282,Current
114,Chemistry,kilograms per meter squared per second (kg/m^2s),"In physics and engineering, mass flux is the rate of mass flow per unit area, perfectly overlapping with the momentum density, the momentum per unit volume. The common symbols are j, J, q, Q, ?, or ? (Greek lower or capital Phi), sometimes with subscript m to indicate mass is the flowing quantity. Its SI units are kg s?1 m?2. Mass flux can also refer to an alternate form of flux in Fick's law that includes the molecular mass, or in Darcy's law that includes the mass density.  [Wikipedia: https://en.wikipedia.org/wiki/Mass_flux]",0,-1.0,0,0.0,-2,L-2M1T-1,0.0,1,Mass flux,,CUAHSI,,/api/v1/unitstype/massFlux/,massFlux,1283,Current
115,Dimensionless Ratio,g/kg,"In chemistry, the mass fraction is the ratio of one substance with mass to the mass of the total mixture , defined asThe sum of all the mass fractions is equal to 1:Mass fraction can also be expressed, with a denominator of 100, as percentage by weight (wt%). It is one way of expressing the composition of a mixture in a dimensionless size; mole fraction (percentage by moles, mol%) and volume fraction (percentage by volume, vol%) are others. For elemental analysis, mass fraction (or ""mass percent composition"") can also refer to the ratio of the mass of one element to the total mass of a compound. It can be calculated for any compound using its empirical formula. or its chemical formula",0,0.0,0,0.0,0,M1M-1,0.0,0,Mass fraction,,Wikipedia,http://dbpedia.org/page/Mass_fraction_(chemistry),/api/v1/unitstype/massFraction/,massFraction,1284,Current
116,Chemistry,Moles per second per kilogram (mol/s*kg),The number of particles or organisms per unit time per unit mass.,0,-1.0,0,1.0,0,M-1T-1N1,0.0,-1,Mass normalized particle loading,,CUAHSI,,/api/v1/unitstype/massNormalizedParticleLoading/,massNormalizedParticleLoading,1285,Current
117,Chemistry,Kilogram per square meter (kg/m^2),,0,0.0,0,0.0,-2,L-2M1,0.0,1,Mass per area,Has same dimensionality as length integrated mass concentration,QUDT,http://qudt.org/vocab/quantity#Massperarea,/api/v1/unitstype/massPerArea/,massPerArea,1286,Current
118,Chemistry,Tesla Second (T s),,0,1.0,0,0.0,0,M1T-1I-1,-1.0,1,Mass per electrical charge,,QUDT,http://qudt.org/vocab/quantity#MassPerElectricCharge,/api/v1/unitstype/massPerElectricalCharge/,massPerElectricalCharge,1287,Current
119,Mechanics,Kilogram per meter (kg/m),,0,0.0,0,0.0,-1,L-1M1,0.0,1,Mass per length,,QUDT,http://qudt.org/vocab/quantity#Massperlength,/api/v1/unitstype/massPerLength/,massPerLength,1288,Current
120,Mechanics,Kilogram per second (kg/s),"In physics and engineering, mass flow rate is the mass of a substance which passes per unit of time. [Wikipedia: https://en.wikipedia.org/wiki/Mass_flow_rate]",0,-1.0,0,0.0,0,M1T-1,0.0,1,Mass per time,Also known as loading.,QUDT,http://qudt.org/vocab/quantity#Masspertime,/api/v1/unitstype/massPerTime/,massPerTime,1289,Current
121,Thermodynamics,Kilogram kelvin (kg-K),,1,0.0,0,0.0,0,M1?1,0.0,1,Mass temperature,,QUDT,http://qudt.org/vocab/quantity#Masstemperature,/api/v1/unitstype/massTemperature/,massTemperature,1290,Current
122,Chemistry,Joule Second per Mole,The angular momentum per mole of substance.  Used for measuring electron orbitals.,0,-1.0,0,-1.0,2,L2M1T-1N-1,0.0,1,Molar angular momentum,,QUDT,http://qudt.org/vocab/quantity#MolarAngularMomentum,/api/v1/unitstype/molarAngularMomentum/,molarAngularMomentum,1291,Current
123,Chemistry,Siemen Square Meter per Mole (Sm^2/mol),"Molar conductivity is defined as the conductivity of an electrolyte solution divided by the molar concentration of the electrolyte, and so measures the efficiency with which a given electrolyte conducts electricity in solution. Its units are siemens per meter per molarity, or siemens meter-squared per mole. The usual symbol is a capital lambda, ?, or ?m. Or Molar conductivity of a solution at a given concentration is the conductance of the volume (V) of the solution containing one mole of electrolyte kept between two electrodes with area of cross section (A) and at a distance of unit length. [Wikipedia: https://en.wikipedia.org/wiki/Molar_conductivity]",0,0.0,0,-1.0,0,M-1I2N-1,2.0,-1,Molar conductivity,,Aquarius,,/api/v1/unitstype/molarConductivity/,molarConductivity,1292,Current
124,Chemistry,Joule per mole (J/mol),The amount of energy per mole of substance,0,-2.0,0,-1.0,2,L2M1T-2N-1,0.0,1,Molar energy,,QUDT,http://qudt.org/schema/qudt#MolarEnergyUnit,/api/v1/unitstype/molarEnergy/,molarEnergy,1293,Current
125,Thermodynamics,Joule per mole kelvin (J/(mol-K)),The molar heat capacity is the heat capacity per unit amount of a pure substance. [Wikipedia: https://en.wikipedia.org/wiki/Heat_capacity],-1,-2.0,0,-1.0,2,L2M1T-2?-1N-1,0.0,1,Molar heat capacity,,QUDT,http://qudt.org/schema/qudt#MolarHeatCapacityUnit,/api/v1/unitstype/molarHeatCapacity/,molarHeatCapacity,1294,Current
126,Chemistry,kilogram per mol (kg/mol),"In chemistry, the molar mass M is a physical property defined as the mass of a given substance (chemical element or chemical compound) divided by its amount of substance.  The base SI unit for molar mass is kg/mol. However, for historical reasons, molar masses are almost always expressed in g/mol. [Wikipedia: https://en.wikipedia.org/wiki/Molar_mass]",0,0.0,0,-1.0,0,M1N-1,0.0,1,Molar mass,<http://dbpedia.org/resource/Molar_mass>,QUDT,http://qudt.org/vocab/quantity#MolarMass,/api/v1/unitstype/molarMass/,molarMass,1295,Current
127,Chemistry,cubic meters per mol (m^3/mol),"The molar volume, symbol Vm, is the volume occupied by one mole of a substance (chemical element or chemical compound) at a given temperature and pressure. It is equal to the molar mass (M) divided by the mass density (?). [Wikipedia: https://en.wikipedia.org/wiki/Molar_volume]",0,0.0,0,-1.0,3,L3N-1,0.0,0,Molar volume,,New for ODM2,http://dbpedia.org/page/Molar_volume,/api/v1/unitstype/molarVolume/,molarVolume,1296,Current
128,Dimensionless,,"A unit that does not belong in any of the other groups.  These units have dimensionality, but are generally strangely compounded or calculated",0,0.0,0,0.0,0,,0.0,0,Other,Catch-all for units I don't know how to deal with,New for ODM2,,/api/v1/unitstype/other/,other,1297,Current
129,Chemistry,moles per meter squared per second,"The number of particles, organisms, or moles of substance going through a specific area in a given amount of time.",0,-1.0,0,1.0,-2,L-2T-1N1,0.0,0,Particle flux,,CUAHSI,,/api/v1/unitstype/particleFlux/,particleFlux,1298,Current
130,Chemistry,Number per second (#/s),"The number of particles, organisms, or moles of substance appearing in a given amount of time.",0,-1.0,0,1.0,0,T-1N1,0.0,0,Particle loading,"Uses units that are similar, if not identical, to catalytic activity.  Both have the same dimensionality.",CUAHSI,,/api/v1/unitstype/particleLoading/,particleLoading,1299,Current
131,Chemistry,pH,"In chemistry, pH (/pi??e?t?/) is a numeric scale used to specify the acidity or alkalinity of an aqueous solution. It is the negative of the logarithm to base 10 of the activity of the hydrogen ion. Solutions with a pH less than 7 are acidic and solutions with a pH greater than 7 are alkaline or basic. Pure water is neutral, being neither an acid nor a base. Contrary to popular belief, the pH value can be less than 0 or greater than 14 for very strong acids and bases respectively. [Wikipedia: https://en.wikipedia.org/wiki/PH]",0,0.0,1,0.0,0,U1,0.0,0,pH,,QUDT-WQ,http://environment.data.gov.au/def/unit/pH,/api/v1/unitstype/pH/,pH,1300,Current
132,Electricity and Magnetism,Square Coulomb Meter per Joule,"Polarizability is the relative tendency of a charge distribution, like the electron cloud of an atom or molecule, to be distorted from its normal shape by an external electric field, which may be caused by the presence of a nearby ion or dipole.  The electronic polarizability ? is defined as the ratio of the induced dipole moment of an atom to the electric field that produces this dipole moment. Polarizability is often a scalar valued quantity, however in the general case it is tensor-valued.",0,4.0,0,0.0,0,M-1T4I2,2.0,-1,Polarizability,<http://dbpedia.org/resource/Polarizability>,QUDT,http://qudt.org/vocab/quantity#Polarizability,/api/v1/unitstype/polarizability/,polarizability,1301,Current
133,Fluid Mechanics,Meter squared Kelvin per kilogram per second,"Potential vorticity (PV) is a quantity which is proportional to the dot product of vorticity and stratification that, following a parcel of air or water, can only be changed by diabatic or frictional processes. It is a useful concept for understanding the generation of vorticity in cyclogenesis (the birth and development of a cyclone), especially along the polar front, and in analyzing flow in the ocean. [Wikipedia: https://en.wikipedia.org/wiki/Potential_vorticity]",1,-1.0,0,0.0,2,L2M-1T-1?1,0.0,-1,Potential vorticity,,UDUnits,http://dbpedia.org/page/Potential_vorticity,/api/v1/unitstype/potentialVorticity/,potentialVorticity,1302,Current
134,Mechanics,Watt (W),"Power is the rate at which work is performed or energy is transmitted, or the amount of energy required or expended for a given unit of time. As a rate of change of work done or the energy of a subsystem, power is: P = W/t where P is power W is work t is time.  Heat flow rate follows identical units to Power",0,-3.0,0,0.0,2,L2M1T-3,0.0,1,Power,,QUDT,http://qudt.org/vocab/quantity#Power,/api/v1/unitstype/power/,power,1303,Current
135,Mechanics,Watt Square Meter,,0,-3.0,0,0.0,4,L4M1T-3,0.0,1,Power area,,QUDT,http://qudt.org/vocab/quantity#PowerArea,/api/v1/unitstype/powerArea/,powerArea,1304,Current
136,Mechanics,Watt Square Meter per Steradian,,0,-3.0,1,0.0,4,U-1L4M1T-3,0.0,1,Power area per solid angle,,QUDT,http://qudt.org/vocab/quantity#PowerAreaPerSolidAngle,/api/v1/unitstype/powerAreaPerSolidAngle/,powerAreaPerSolidAngle,1305,Current
137,Mechanics,Watt per square meter (W/m^2),"A general term for heat flow rate per unit area, power per unit area, irradiance, radient emmitance, and radiosity.  All these terms are sometimes referred to as ""intensity.""",0,-3.0,0,0.0,0,M1T-3,0.0,1,Power per area,,QUDT,http://qudt.org/vocab/quantity#Powerperarea,/api/v1/unitstype/powerPerArea/,powerPerArea,1306,Current
138,Thermodynamics,Watt per Square Meter Quartic Kelvin,"The units of the Stefan-Boltzmann constant.  The Stefan–Boltzmann law states that the total energy radiated per unit surface area of a black body across all wavelengths per unit time (also known as the black-body radiant exitance or emissive power), j*, is directly proportional to the fourth power of the black body's thermodynamic temperature.  The constant of proportionality ?, called the Stefan–Boltzmann constant or Stefan's constant, derives from other known constants of nature. The value of the constant is5.670373 x 10^8 Wm^-2K^-4.  [Wikipedia: https://en.wikipedia.org/wiki/Stefan%E2%80%93Boltzmann_constant]",-4,-3.0,0,0.0,0,M1T-3?-4,0.0,1,Power per area quartic temperature,,QUDT,http://qudt.org/vocab/quantity#PowerPerAreaQuarticTemperature,/api/v1/unitstype/powerPerAreaQuarticTemperature/,powerPerAreaQuarticTemperature,1307,Current
139,Electricity and Magnetism,Volt per Second,,0,-4.0,0,0.0,2,L2M1T-4I-1,-1.0,1,Power per electrical charge,,QUDT,http://qudt.org/vocab/quantity#PowerPerElectricCharge,/api/v1/unitstype/powerPerElectricalCharge/,powerPerElectricalCharge,1308,Current
140,Space and Time,Pascal (Pa),"Pressure is an effect which occurs when a force is applied on a surface. Pressure is the amount of force acting on a unit area. Pressure is distinct from stress, as the former is the ratio of the component of force normal to a surface to the surface area. Stress is a tensor that relates the vector force to the vector area.",0,-2.0,0,0.0,-1,L-1M1T-2,0.0,1,Pressure or stress,Has identical dimensionality to energy density,QUDT,http://qudt.org/vocab/quantity#Pressureorstress,/api/v1/unitstype/pressureOrStress/,pressureOrStress,1309,Current
141,Space and Time,Pascal per second (Pa/s),,0,-3.0,0,0.0,-1,L-1M1T-3,0.0,1,Pressure or stress rate,,QUDT,http://qudt.org/schema/qudt#PressureOrStressRateUnit,/api/v1/unitstype/pressureOrStressRate/,pressureOrStressRate,1310,Current
142,Electricity and Magnetism,Quartic Coulomb Meter per Cubic Joule (C^4 m^4 J^-3),,0,10.0,0,0.0,-2,L-2M-3T10I4,4.0,-3,Quartic electrical dipole moment per cubic energy,,QUDT,http://qudt.org/vocab/quantity#QuarticElectricDipoleMomentPerCubicEnergy,/api/v1/unitstype/quarticElectricDipoleMomentPerCubicEnergy/,quarticElectricDipoleMomentPerCubicEnergy,1311,Current
143,Radiology,Watt per square meter steradian (W/(m^2-sr)),"In radiometry, radiance is the radiant flux emitted, reflected, transmitted or received by a surface, per unit solid angle per unit projected area. Radiance is used to characterize diffuse emission and reflection of electromagnetic radiation, or to quantify emission of neutrinos and other particles. This is a directional quantity. Historically, radiance is called ""intensity"" and spectral radiance is called ""specific intensity"". [Wikipedia: https://en.wikipedia.org/wiki/Radiance]",0,-3.0,-1,0.0,0,U-1M1T-3,0.0,1,Radiance,,QUDT,http://qudt.org/schema/qudt#RadianceUnit,/api/v1/unitstype/radiance/,radiance,1312,Current
144,Radiology,Watt per steradian (W/sr),"Radiant flux emitted, reflected, transmitted or received, per unit solid angle. This is a directional quantity. [Wikipedia: https://en.wikipedia.org/wiki/Radiant_intensity]",0,-3.0,-1,0.0,2,U-1L2M1T-3,0.0,1,Radiant Intensity,,QUDT,http://qudt.org/schema/qudt#RadiantIntensityUnit,/api/v1/unitstype/radiantIntensity/,radiantIntensity,1313,Current
145,Quantum Mechanics,Becquerel (Bq),"Activity is the term used to characterise the number of nuclei which disintegrate in a radioactive substance per unit time. Activity is usually measured in Becquerels (Bq), where 1 Bq is 1 disintegration per second.",0,-1.0,0,0.0,0,T-1,0.0,0,Radioactivity,,QUDT,http://qudt.org/vocab/quantity#Activity,/api/v1/unitstype/radioactivity/,radioactivity,1314,Current
146,Quantum Mechanics,Becquerels per meter cubed (Bq/m^3),The amount of radioactivity per unit volume,0,-1.0,0,0.0,-3,L-3T-1,0.0,0,Radioactivity per volume,,New for ODM2,,/api/v1/unitstype/radioactivityPerVolume/,radioactivityPerVolume,1315,Current
147,Chemistry,Practical salinity units (PSU),"Salinity is the saltiness or dissolved salt content of a body of water. Salinity is an important factor in determining many aspects of the chemistryof natural waters and of biological processes within it, and is a thermodynamic state variable that, along with temperature and pressure, governs physical characteristics like the density and heat capacity of the water. The use of electrical conductivity measurements to estimate the ionic content of seawater led to the development of the so-called practical salinity scale 1978 (PSS-78). Salinities measured using PSS-78 do not have units. The 'unit' of PSU (denoting practical salinity unit) is sometimes added to PSS-78 measurements, however this is officially discouraged.",0,0.0,1,0.0,0,U1,0.0,0,Salinity,,Wikipedia,http://dbpedia.org/page/Salinity,/api/v1/unitstype/salinity/,salinity,1316,Current
148,Space and Time,meter per pixel,"In remote sensing, a satellite's resolution is defined as the size on the earth of the smallest individual component or dot (called a pixel) from which the image is constituted.  This is also reffered to as the ground sample distance.",0,0.0,0,-1.0,1,L1N-1,0.0,0,Satellite resolution,,CUAHSI,,/api/v1/unitstype/satelliteResolution/,satelliteResolution,1317,Current
149,Mechanics,Meters per quartic second (m/s^4),"In physics, jounce or snap is the fourth derivative of the position vector with respect to time, with the first, second, and third derivatives being velocity, acceleration, and jerk, respectively; hence, the jounce is the rate of change of the jerk with respect to time. [Wikipedia: https://en.wikipedia.org/wiki/Jounce]",0,-4.0,0,0.0,1,L1T-4,0.0,0,Snap,,Aquarius,,/api/v1/unitstype/snap/,snap,1318,Current
150,Space and Time,Steradian (sr),"The solid angle subtended by a surface S is defined as the surface area of a unit sphere covered by the surface S's projection onto the sphere. A solid angle is related to the surface of a sphere in the same way an ordinary angle is related to the circumference of a circle. Since the total surface area of the unit sphere is 4*pi, the measure of solid angle will always be between 0 and 4*pi.",0,0.0,1,0.0,0,U1,0.0,0,Solid angle,,QUDT,http://qudt.org/vocab/quantity#Solidangle,/api/v1/unitstype/solidAngle/,solidAngle,1319,Current
151,Mechanics,Joule per kilogram (J/kg); Gray (Gy); Sievert (Sv),"Specific energy is energy per unit mass. (It is also sometimes called ""energy density,"" though ""energy density"" more precisely means energy per unit volume.) The SI unit for specific energy is the joule per kilogram (J/kg). Other units still in use in some contexts are the kilocalorie per gram (Cal/g or kcal/g), mostly in food-related topics, watt hours per kilogram in the field of batteries, and the Imperial unit BTU per pound (BTU/lb), in some engineering and applied technical fields.",0,-2.0,0,0.0,2,L2T-2,0.0,0,Specific energy,"Absorbed dose, does equivalent, and specific energy all have the same dimensionality.",QUDT,http://qudt.org/vocab/quantity#Specificenergy,/api/v1/unitstype/specificEnergy/,specificEnergy,1320,Current
152,Thermodynamics,Joule per kilogram kelvin (J/(kg-K)),"The specific heat capacity, often simply called specific heat, is the heat capacity per unit mass of a material.  It is the amount of heat needed to raise the temperature of a certain mass 1 degree Celsius.",-1,-2.0,0,0.0,2,L2T-2?-1,0.0,0,Specific heat capacity,,QUDT,http://qudt.org/vocab/quantity#Specificheatcapacity,/api/v1/unitstype/specificHeatCapacity/,specificHeatCapacity,1321,Current
153,Thermodynamics,Joule per kilogram kelvin per pascal (J/(km-K-Pa)),Specific heat at a constant pressure.,-1,0.0,0,0.0,3,L3M-1?-1,0.0,-1,Specific heat pressure,,QUDT,http://qudt.org/vocab/quantity#Specificheatpressure,/api/v1/unitstype/specificHeatPressure/,specificHeatPressure,1322,Current
154,Thermodynamics,Joule per kilogram kelvin per cubic meter (J/(kg-K-m^3)),Specific heat per constant volume.,-1,-2.0,0,0.0,-1,L-1T-2?-1,0.0,0,Specific heat volume,,QUDT,http://qudt.org/vocab/quantity#Specificheatvolume,/api/v1/unitstype/specificHeatVolume/,specificHeatVolume,1323,Current
155,Quantum Mechanics,Becquerels per gram (Bq/g),Specific activity is the activity per mass quantity of a radionuclide and is a physical property of that radionuclide. [Wikipedia: https://en.wikipedia.org/wiki/Specific_activity],0,-1.0,0,0.0,0,M-1T-1,0.0,-1,Specific radioactivity,,CUAHSI,http://dbpedia.org/page/Specific_activity,/api/v1/unitstype/specificRadioactivity/,specificRadioactivity,1324,Current
156,Mechanics,Meters squared per kilogram (m²/kg),"Specific surface area ""SSA"" is a property of solids which is the total surface area of a material per unit of mass. It is a derived scientific value that can be used to determine the type and properties of a material (e.g. soil, snow). It is defined by surface area divided by mass (with units of m²/kg).",0,0.0,0,0.0,2,L2M-1,0.0,-1,Specific surface area,,Wikipedia,http://dbpedia.org/page/Specific_surface_area,/api/v1/unitstype/specificSurfaceArea/,specificSurfaceArea,1325,Current
157,Mechanics,meter cubed per kg,Specific volume (?) is the volume occupied by a unit of mass of a material. It is equal to the inverse of density.,0,0.0,0,0.0,3,L3M-1,0.0,-1,Specific volume,,QUDT,http://qudt.org/vocab/quantity#Specificvolume,/api/v1/unitstype/specificVolume/,specificVolume,1326,Current
158,Chemistry,Per Mille (‰; per mil) relative to a standard reference material,"For stable isotopes, isotope ratios are typically reported using the delta (?) notation where ? represents the ratio of heavy isotope to light isotope in the sample over the same ratio of a standard reference material, reported using units of in ""per mil"" (‰, parts per thousand) and reported relative to the specific standard reference material.",0,0.0,1,0.0,0,U1,0.0,0,Stable isotope delta,,Wikipedia,https://en.wikipedia.org/wiki/Isotope_geochemistry#Stable_isotope_geochemistry,/api/v1/unitstype/stableIsotopeDelta/,stableIsotopeDelta,1327,Current
