,category,default_unit,definition,dimension_amount,dimension_current,dimension_length,dimension_light,dimension_mass,dimension_symbol,dimension_temperature,dimension_time,name,note,provenance,provenance_uri,resource_uri,term,vocabulary_id,vocabulary_status
159,Mechanics,Cubic Meter per Second Squared,"In celestial mechanics, the standard gravitational parameter ? of a celestial body is the product of the gravitational constant G and the mass M of the body. [Wikipedia: https://en.wikipedia.org/wiki/Standard_gravitational_parameter]",0,-2.0,0,0.0,3,L3T-2,0.0,0,Standard gravitational parameter,<http://dbpedia.org/resource/Standard_gravitational_parameter>,QUDT,http://qudt.org/vocab/quantity#StandardGravitationalParameter,/api/v1/unitstype/standardGravitationalParameter/,standardGravitationalParameter,1328,Current
160,Base Quantity,Kelvin (K),"A temperature is a numerical measure of hot and cold. Its measurement is by detection of heat radiation or particle velocity or kinetic energy, or by the bulk behavior of a thermometric material. It may be calibrated in any of various temperature scales, Celsius, Fahrenheit, Kelvin, etc. The fundamental physical definition of temperature is provided by thermodynamics.",1,0.0,0,0.0,0,?1,0.0,0,Temperature,,QUDT,http://qudt.org/vocab/quantity#ThermodynamicTemperature,/api/v1/unitstype/temperature/,temperature,1329,Current
161,Thermodynamics,Mole kelvin (mol-K),,1,0.0,0,1.0,0,?1N1,0.0,0,Temperature count,,QUDT,http://qudt.org/schema/qudt#AmountOfSubstanceTemperatureUnit,/api/v1/unitstype/temperatureCount/,temperatureCount,1330,Current
162,Thermodynamics,Kelvin per Tesla,,1,2.0,0,0.0,0,M-1T2I1?1,1.0,-1,Temperature per magnetic flux density,,QUDT,http://qudt.org/vocab/quantity#TemperaturePerMagneticFluxDensity,/api/v1/unitstype/temperaturePerMagneticFluxDensity/,temperaturePerMagneticFluxDensity,1331,Current
163,Thermodynamics,Kelvin per second (K/s),,1,-1.0,0,0.0,0,T-1?1,0.0,0,Temperature per time,,QUDT,http://qudt.org/vocab/quantity#TemperaturePerTime,/api/v1/unitstype/temperaturePerTime/,temperaturePerTime,1332,Current
164,Thermodynamics,Watt per meter kelvin (W/(m*K)),"In physics, thermal conductivity (often denoted k, ?, or ?) is the property of a material to conduct heat. Thermal conductivity of materials is temperature dependent. The reciprocal of thermal conductivity is called thermal resistivity.",-1,-3.0,0,0.0,1,L1M1T-3?-1,0.0,1,Thermal conductivity,,QUDT,http://qudt.org/vocab/quantity#Thermalconductivity,/api/v1/unitstype/thermalConductivity/,thermalConductivity,1333,Current
165,Thermodynamics,Square meter Kelvin per watt (K(m^2)/W),The inverse of the heat transfer coefficient.,1,3.0,0,0.0,0,M-1T3?1,0.0,-1,Thermal insulance,,QUDT,http://qudt.org/vocab/quantity#Thermalinsulance,/api/v1/unitstype/thermalInsulance/,thermalInsulance,1334,Current
166,Thermodynamics,Kelvin per watt (K/W),"Thermal resistance is a heat property and a measurement of a temperature difference by which an object or material resists a heat flow. Thermal resistance is the reciprocal of thermal conductance. (Absolute) thermal resistance R in K/W is a property of a particular component. For example, a characteristic of a heat sink. Specific thermal resistance or specific thermal resistivity R? in (K·m)/W is a material constant.",1,3.0,0,0.0,-2,L-2M-1T3?1,0.0,-1,Thermal resistance,,Wikipedia,http://dbpedia.org/page/Thermal_resistance,/api/v1/unitstype/thermalResistance/,thermalResistance,1335,Current
167,Thermodynamics,Meter Kelvin per watt (K-m/W),"The reciprocal of thermal conductivity is thermal resistivity, measured in kelvin-metres per watt (K*m/W). Also called Specific Thermal Resistance.",1,3.0,0,0.0,-1,L-1M-1T3?1,0.0,-1,Thermal resistivity,,QUDT,http://qudt.org/vocab/quantity#Thermalresistivity,/api/v1/unitstype/thermalResistivity/,thermalResistivity,1336,Current
168,Mechanics,Newton per kilogram (N/kg),"Thrust-to-weight ratio is a dimensionless ratio of thrust to weight of a rocket, jet engine, propeller engine, or a vehicle propelled by such an engine that indicates the performance of the engine or vehicle. [Wikipedia: https://en.wikipedia.org/wiki/Thrust-to-weight_ratio]",0,-2.0,0,0.0,1,L1T-2,0.0,0,Thrust to mass ratio,Same dimensionality as linear accelleration,QUDT,http://qudt.org/vocab/quantity#ThrustToMassRatio,/api/v1/unitstype/thrustToMassRatio/,thrustToMassRatio,1337,Current
169,Base Quantity,second (s),"Time is a basic component of the measuring system used to sequence events, to compare the durations of events and the intervals between them, and to quantify the motions of objects.",0,1.0,0,0.0,0,T1,0.0,0,Time,,QUDT,http://qudt.org/vocab/quantity#Time,/api/v1/unitstype/time/,time,1338,Current
170,Space and Time,Second time squared (s^2),,0,2.0,0,0.0,0,T2,0.0,0,Time squared,,QUDT,http://qudt.org/vocab/quantity#Timesquared,/api/v1/unitstype/timeSquared/,timeSquared,1339,Current
171,Mechanics,Newton meter (N-m),"In physics, a torque (?) is a vector that measures the tendency of a force to rotate an object about some axis [1]. The magnitude of a torque is defined as force times its lever arm [2]. Just as a force is a push or a pull, a torque can be thought of as a twist. The SI unit for torque is newton meters (N m). In U.S. customary units, it is measured in foot pounds (ft lbf) (also known as 'pounds feet'). Mathematically, the torque on a particle (which has the position r in some reference frame) can be defined as the cross product: ? = r x F where r is the particle's position vector relative to the fulcrum F is the force acting on the particles, or, more generally, torque can be defined as the rate of change of angular momentum, ? = dL/dt where L is the angular momentum vector t stands for time.",0,-2.0,0,0.0,2,L2M1T-2,0.0,1,Torque,Has the same dimensionality as energy/work,QUDT,http://qudt.org/vocab/quantity#Torque,/api/v1/unitstype/torque/,torque,1340,Current
172,Chemistry,Nephelometric Turbidity Units (NTU),"Turbidity is the cloudiness or haziness of a fluid, or of air, caused by individual particles (suspended solids) that are generally invisible to the naked eye, similar to smoke in air. Turbidity in open water is often caused by phytoplankton and the measurement of turbidity is a key test of water quality. The higher the turbidity, the higher the risk of the drinkers developing gastrointestinal diseases, especially for immune-compromised people, because contaminants like virus or bacteria can become attached to the suspended solid. The suspended solids interfere with water disinfection with chlorine because the particles act as shields for the virus and bacteria. Similarly suspended solids can protect bacteria from UV sterilisation of water. Fluids can contain suspended solid matter consisting of particles of many different sizes. While some suspended material will be large enough and heavy enough to settle rapidly to the bottom container if a liquid sample is left to stand (the settleable solids), very small particles will settle only very slowly or not at all if the sample is regularly agitated or the particles are colloidal. These small solid particles cause the liquid to appear turbid.",0,0.0,1,0.0,0,U1,0.0,0,Turbidity,,QUDT,http://qudt.org/vocab/quantity#Turbidity,/api/v1/unitstype/turbidity/,turbidity,1341,Current
173,Space and Time,Cubic Meter (m^3),,0,0.0,0,0.0,3,L3,0.0,0,Volume,"This includes dry, liquid, and gas volumes.",QUDT,http://qudt.org/vocab/quantity#LiquidVolume,/api/v1/unitstype/volume/,volume,1342,Current
174,Thermodynamics,Cubic meter per kelvin (m^3/K),"When the temperature of a substance changes, the energy that is stored in the intermolecular bonds between atoms changes. When the stored energy increases, so does the length of the molecular bonds. As a result, solids typically expand in response to heating and contract on cooling; this dimensional response to temperature change is expressed by its coefficient of thermal expansion. Different coefficients of thermal expansion can be defined for a substance depending on whether the expansion is measured by: * linear thermal expansion * area thermal expansion * volumetric thermal expansion These characteristics are closely related. The volumetric thermal expansion coefficient can be defined for both liquids and solids. The linear thermal expansion can only be defined for solids, and is common in engineering applications. Some substances expand when cooled, such as freezing water, so they have negative thermal expansion coefficients.",-1,0.0,0,0.0,3,L3?-1,0.0,0,Volume thermal expansion,,QUDT,http://qudt.org/vocab/quantity#Volumethermalexpansion,/api/v1/unitstype/volumeThermalExpansion/,volumeThermalExpansion,1343,Current
175,Mechanics,Cubic meter per second (m^3/s),"Volume Per Unit Time, or Volumetric flow rate, is the volume of fluid that passes through a given surface per unit of time (as opposed to a unit surface).",0,-1.0,0,0.0,3,L3T-1,0.0,0,Volumetric flow rate,,QUDT,http://qudt.org/vocab/quantity#Volumepertime,/api/v1/unitstype/volumetricFlowRate/,volumetricFlowRate,1344,Current
176,Mechanics,meters cubed per second per meter squared (m^3/s*m^2),"In fluid dynamics, the volumetric flux is the rate of volume flow across a unit area (m3·s?1·m?2). Volumetric flux = liters/(second*area). The density of a particular property in a fluid's volume, multiplied with the volumetric flux of the fluid, thus defines the advective flux of that property.  The volumetric flux through a porous medium is often modelled using Darcy's law. Volumetric flux is not to be confused with volumetric flow rate, which is the volume of fluid that passes through a given surface per unit of time (as opposed to a unit surface).  [Wikipedia: https://en.wikipedia.org/wiki/Volumetric_flux] Also used for hydraulic conductivity.",0,-1.0,0,0.0,1,L1T-1,0.0,0,Volumetric flux,"Has identical dimensionality to linear velocity, but is expressed differently.",Wikipedia,http://dbpedia.org/page/Volumetric_flux,/api/v1/unitstype/volumetricFlux/,volumetricFlux,1345,Current
177,Thermodynamics,Joule per cubic meter kelvin (J/(m^3 K)),"Volumetric heat capacity (VHC), also termed volume-specific heat capacity, describes the ability of a given volume of a substance to store internal energy while undergoing a given temperature change, but without undergoing a phase transition. It is different from specific heat capacity in that the VHC is a 'per unit volume' measure of the relationship between thermal energy and temperature of a material, while the specific heat is a 'per unit mass' measure (or occasionally per molar quantity of the material).",-1,-2.0,0,0.0,-1,L-1M1T-2?-1,0.0,1,Volumetric heat capacity,,QUDT,http://qudt.org/vocab/quantity#Volumetricheatcapacity,/api/v1/unitstype/volumetricHeatCapacity/,volumetricHeatCapacity,1346,Current
178,Chemistry,Kilograms per cubic meter per second,"In ecology, productivity or production refers to the rate of generation of biomass in an ecosystem. It is usually expressed in units of mass per unit surface (or volume) per unit time, for instance grams per square metre per day (g m?2 d?1). The mass unit may relate to dry matter or to the mass of carbon generated. Productivity of autotrophs such as plants is called primary productivity, while that of heterotrophs such as animals is called secondary productivity. [Wikipedia: https://en.wikipedia.org/wiki/Productivity_%28ecology%29]",0,-1.0,0,0.0,-3,L-3M1T-1,0.0,1,Volumetric productivity,,CUAHSI,,/api/v1/unitstype/volumetricProductivity/,volumetricProductivity,1347,Current
179,Mechanics,Newtons per second (N/s),Yank is the rate of change of force.,0,-3.0,0,0.0,1,L1M1T-3,0.0,1,Yank,,Aquarius,,/api/v1/unitstype/yank/,yank,1348,Current
